{
  "company": {
    "name": "Best Buy Co., Inc.",
    "ticker": "BBY [s1]",
    "headquarters": "Richfield, Minnesota [s1]",
    "employees": "Approximately 82,000 employees at the end of fiscal 2026 [s1]",
    "fiscalYearEnd": "Saturday nearest the end of January; fiscal 2026 ended January 31, 2026 [s1]",
    "industry": "Specialty consumer-electronics retail and technology services [s1]",
    "summary": "Best Buy is an omnichannel consumer-technology retailer operating through Domestic and International segments [s1]. It enters a CEO transition with improving fiscal 2027 comparable sales, a recently appointed technology chief, and active AI, marketplace, and customer-experience programs, but its private engineering estate and specific modernization backlog are not public [s3][s4][s6][s11]."
  },
  "generatedAt": "2026-09-24",
  "confidence": "partially sourced",
  "overview": {
    "whatTheyDo": "Best Buy sells consumer electronics, appliances, computing and mobile products, entertainment products, and related services through stores and digital channels in the United States and Canada [s1].",
    "scale": [
      {
        "label": "Fiscal 2026 revenue",
        "value": "$41.69 billion",
        "sourceId": "s1"
      },
      {
        "label": "Employees",
        "value": "Approximately 82,000 at fiscal 2026 year-end",
        "sourceId": "s1"
      },
      {
        "label": "Stores",
        "value": "1,068 at fiscal 2026 year-end",
        "sourceId": "s1"
      },
      {
        "label": "Q2 fiscal 2027 revenue",
        "value": "$9.78 billion",
        "sourceId": "s3"
      }
    ],
    "segments": [
      {
        "name": "Domestic",
        "note": "United States operations, including Best Buy, Best Buy Ads, Best Buy Health, Geek Squad, and related brands and services.",
        "sourceId": "s1"
      },
      {
        "name": "International",
        "note": "Operations in Canada under the Best Buy and Best Buy Express brands.",
        "sourceId": "s1"
      }
    ]
  },
  "trends": {
    "trajectory": "Best Buy moved from fiscal 2026 revenue of $41.69 billion to positive enterprise comparable-sales growth in each of the first two fiscal 2027 quarters, then raised full-year guidance after Q2 [s1][s2][s3]. The growth agenda includes the Mirakl-powered marketplace, customer-care AI, Ask Blue, and agentic-commerce work, while tariff exposure, uneven consumer demand, and incumbent-platform concentration raise the proof threshold for new engineering spend [s9][s11][s12][s14][s18].",
    "financials": [
      {
        "period": "Q1 fiscal 2027",
        "metric": "Revenue",
        "value": "$8.94 billion",
        "direction": "up",
        "sourceId": "s2"
      },
      {
        "period": "Q1 fiscal 2027",
        "metric": "Enterprise comparable sales",
        "value": "Increased 2.0%",
        "direction": "up",
        "sourceId": "s2"
      },
      {
        "period": "Q1 fiscal 2027",
        "metric": "Net earnings",
        "value": "$276 million",
        "direction": "up",
        "sourceId": "s2"
      },
      {
        "period": "Q1 fiscal 2027",
        "metric": "Adjusted diluted EPS",
        "value": "$1.28",
        "direction": "up",
        "sourceId": "s2"
      },
      {
        "period": "Q2 fiscal 2027",
        "metric": "Revenue",
        "value": "$9.78 billion",
        "direction": "up",
        "sourceId": "s3"
      },
      {
        "period": "Q2 fiscal 2027",
        "metric": "Enterprise comparable sales",
        "value": "Increased 4.1%",
        "direction": "up",
        "sourceId": "s3"
      },
      {
        "period": "Q2 fiscal 2027",
        "metric": "Diluted EPS",
        "value": "$1.48, increased 70%",
        "direction": "up",
        "sourceId": "s3"
      },
      {
        "period": "Q2 fiscal 2027",
        "metric": "Adjusted diluted EPS",
        "value": "$1.47, increased 15%",
        "direction": "up",
        "sourceId": "s3"
      }
    ],
    "guidance": [
      {
        "item": "Fiscal 2027 revenue",
        "value": "$42.3 billion to $42.8 billion",
        "sourceId": "s3"
      },
      {
        "item": "Fiscal 2027 enterprise comparable sales",
        "value": "Growth of 1.9% to 3.0%",
        "sourceId": "s3"
      },
      {
        "item": "Fiscal 2027 adjusted diluted EPS",
        "value": "$6.70 to $6.90",
        "sourceId": "s3"
      }
    ],
    "industry": [
      {
        "trend": "CTA forecast U.S. consumer-technology revenue of $565 billion in 2026 while highlighting tariff pressure and economic uncertainty.",
        "implication": "Best Buy needs fast pricing, assortment, promotion, and supplier-data changes, but discretionary technology programs must show a near-term revenue or margin link.",
        "sourceId": "s18"
      },
      {
        "trend": "Agentic-commerce channels are becoming part of Best Buy's customer-acquisition strategy through Ask Blue and work with OpenAI.",
        "implication": "Product data, inventory, pricing, identity, measurement, and governance must work consistently across Best Buy and external AI surfaces.",
        "sourceId": "s14"
      }
    ],
    "pressures": [
      {
        "pressure": "Consumer and tariff uncertainty",
        "evidence": "Industry forecasts pair modest technology-market growth with tariff and macroeconomic uncertainty.",
        "sourceId": "s18"
      },
      {
        "pressure": "Workforce and operating discipline",
        "evidence": "Best Buy reported approximately 82,000 employees at fiscal 2026 year-end, down from approximately 85,000 a year earlier.",
        "sourceId": "s1"
      },
      {
        "pressure": "Concurrent transformation load",
        "evidence": "The company is managing a CEO transition, a reshaped executive team, a new CFO, marketplace expansion, and multiple AI customer-experience programs in the same fiscal year.",
        "sourceId": "s5"
      }
    ]
  },
  "catalysts": [
    {
      "date": "2025-06-26",
      "event": "Best Buy appointed Neal Sample as executive vice president and chief digital and technology officer.",
      "whyItMatters": "A technology leader still early in tenure has a mandate to shape the next phase of Best Buy's digital and technology transformation.",
      "urgency": "high",
      "sourceId": "s6"
    },
    {
      "date": "2025-08-19",
      "event": "Best Buy launched its Mirakl-powered U.S. digital marketplace, more than doubling the products available on BestBuy.com and the Best Buy app.",
      "whyItMatters": "A third-party marketplace adds seller, catalog, pricing, fulfillment, trust, and support integration surfaces with measurable commerce outcomes.",
      "urgency": "high",
      "sourceId": "s11"
    },
    {
      "date": "2026-04-22",
      "event": "Best Buy announced that Jason Bonfig would succeed Corie Barry as CEO after the end of the third quarter, effective November 1, 2026.",
      "whyItMatters": "An imminent CEO transition creates a short window to align a bounded engineering initiative to the incoming leader's customer, product, and fulfillment agenda.",
      "urgency": "high",
      "sourceId": "s4"
    },
    {
      "date": "2026-07-14",
      "event": "Best Buy announced a reshaped executive team around its strategic priorities.",
      "whyItMatters": "Newly expanded revenue, strategy, operations, retail, services, legal, and risk remits make ownership clearer but may also delay decisions while responsibilities settle.",
      "urgency": "high",
      "sourceId": "s5"
    },
    {
      "date": "2026-08-19",
      "event": "Anne Bramman became executive vice president and chief financial officer.",
      "whyItMatters": "A new CFO can reset investment evidence and procurement expectations, so a bottom-up value case should be established before seeking broad deployment.",
      "urgency": "medium",
      "sourceId": "s8"
    },
    {
      "date": "2026-09-24",
      "event": "Best Buy was publicly deploying Ask Blue and working with OpenAI on agentic commerce while also using AI internally for employee support.",
      "whyItMatters": "AI has moved into customer and employee workflows, increasing the need for governed delivery, reliable product data, and measurable software change.",
      "urgency": "high",
      "sourceId": "s14"
    }
  ],
  "techEstate": {
    "stack": [
      {
        "technology": "Google Cloud AI",
        "evidence": "Google Cloud documents Best Buy using its AI platform for voice and digital customer care, with a 50% improvement in call containment and faster development cycles.",
        "sourceId": "s9"
      },
      {
        "technology": "Google Cloud real-time retail services",
        "evidence": "Google Cloud documents Best Buy deploying cost-efficient, real-time features for online shopping, customer trust, and revenue growth.",
        "sourceId": "s20"
      },
      {
        "technology": "Accenture delivery partnership",
        "evidence": "Best Buy, Google Cloud, and Accenture announced a collaboration to deploy generative AI for customer support; this April 2024 source is older than 24 months and is corroborated by the current Google Cloud case study.",
        "sourceId": "s10"
      },
      {
        "technology": "Mirakl marketplace platform",
        "evidence": "Best Buy's U.S. third-party marketplace is powered by Mirakl.",
        "sourceId": "s12"
      },
      {
        "technology": "OpenAI agentic-commerce integration",
        "evidence": "Best Buy was reported working with OpenAI on agentic commerce as part of its current AI commerce strategy.",
        "sourceId": "s14"
      },
      {
        "technology": "Public developer APIs and GitHub repositories",
        "evidence": "The BestBuyAPIs GitHub organization exposes public API documentation, SDK, command-line, and query-builder repositories; this public footprint is useful but does not establish the current private stack.",